{
  "schema_version": "ultrajarvis.review-result/v1",
  "review_id": "UJ-REVIEW-RED-001-CHATGPT-20260820-R3",
  "created_at": "2026-08-20T09:20:00Z",
  "repository": {
    "full_name": "carnascialichristian-wq/ultraJARVIS",
    "commit_sha": "69acbf28167e40767fc5c98172b66358cbe4c17d"
  },
  "task_id": "UJ-RED-001",
  "task_owner": "GROK",
  "reviewer": {
    "ai_id": "CHATGPT",
    "product": "ChatGPT Work Mode with GitHub connector"
  },
  "artifacts_reviewed": [
    {
      "ref": "docs/evaluations/ZERO_COST_FALSIFICATION_REPORT.md",
      "sha256": "25db8e963fb26259c757d5c914834a46714569c2514b0c059391f3b9c3200f20"
    },
    {
      "ref": "docs/evaluations/UJ-RESPONSE-RED-001-GROK-20260819.json",
      "sha256": "06a649f07f4388895c7c3baa133ddbfcf5af2b8be55dc3daf90be1883550280c"
    },
    {
      "ref": "schemas/response-packet.schema.json",
      "sha256": "ee44e1b7e262bc0817e0b4f65de8830d122687618a59774fdabfddf3b7e69c0a"
    }
  ],
  "outcome": "PASS_WITH_ACTIONS",
  "criteria": [
    {
      "criterion_id": "AC-01",
      "result": "PASS",
      "evidence_refs": [
        "docs/evaluations/ZERO_COST_FALSIFICATION_REPORT.md"
      ],
      "note": "All 18 findings include the requested evidence, impact, severity, probability, detectability, reproducible falsification test, mitigation, owner and STOP/GO condition."
    },
    {
      "criterion_id": "AC-02",
      "result": "PASS",
      "evidence_refs": [
        "docs/evaluations/ZERO_COST_FALSIFICATION_REPORT.md"
      ],
      "note": "The report covers zero-card, cloud-only, automatic, subscription, paid-provider, quota, billing, local fallback and provider-failure scenarios."
    },
    {
      "criterion_id": "AC-03",
      "result": "PASS",
      "evidence_refs": [
        "docs/evaluations/ZERO_COST_FALSIFICATION_REPORT.md"
      ],
      "note": "DepthGuard, Human Bridge, memory poisoning, Skill Forge, supply-chain exposure and progress/ETA gaming are covered."
    },
    {
      "criterion_id": "AC-04",
      "result": "PASS",
      "evidence_refs": [
        "docs/evaluations/ZERO_COST_FALSIFICATION_REPORT.md"
      ],
      "note": "Reversible local, dry-run, mock and hard zero-cost alternatives are compared without treating unverified free services as active."
    },
    {
      "criterion_id": "AC-05",
      "result": "PASS",
      "evidence_refs": [
        "docs/evaluations/UJ-RESPONSE-RED-001-GROK-20260819.json",
        "schemas/response-packet.schema.json",
        "https://github.com/carnascialichristian-wq/ultraJARVIS/commit/69acbf28167e40767fc5c98172b66358cbe4c17d"
      ],
      "note": "Direct closed-schema validation passes; the packet contains only the external report in artifacts, its report hash matches, it proposes REVIEW, and the ledger remains 0/13. The exact packet SHA-256 is 06a649f07f4388895c7c3baa133ddbfcf5af2b8be55dc3daf90be1883550280c."
    }
  ],
  "findings": [
    {
      "finding_id": "F-001",
      "severity": "INFO",
      "description": "The packet claims a validate-response-packet.mjs --skip-hashes run, but that script is not present in Grok's delivery branch, so that specific command cannot be reproduced from the exact delivery checkout.",
      "required_action": "No delivery blocker. Preserve the command provenance or make the canonical packet validator available in the repository for future reproducibility; the direct schema, report hash, program validator and council validator all pass."
    }
  ],
  "policy_checks": {
    "zero_cost": "PASS",
    "data_class": "PASS",
    "side_effect": "PASS",
    "secret_handling": "PASS",
    "consumer_ui_automation": "PASS"
  },
  "accepted_weight_before": 0,
  "accepted_weight_after": 0,
  "proposed_task_status": "REVIEW",
  "next_action": "Import the corrected packet only after UJ-RED-001 is transitioned from READY to REVIEW by the authorized integration flow. Keep accepted_weight at 0/13; follow-up work includes the hard UJ_ZERO_COST profile."
}
