{
  "schema_version": "ultrajarvis.review-result/v1",
  "review_id": "UJ-REVIEW-RED-001-CHATGPT-20260819-R2",
  "created_at": "2026-08-19T13:05:00Z",
  "repository": {
    "full_name": "carnascialichristian-wq/ultraJARVIS",
    "commit_sha": "a71e08e97e0033a314c26cb4b05d5017bceacc84"
  },
  "task_id": "UJ-RED-001",
  "task_owner": "GROK",
  "reviewer": {
    "ai_id": "CHATGPT",
    "product": "ChatGPT Work Mode with GitHub connector"
  },
  "artifacts_reviewed": [
    {
      "ref": "docs/evaluations/ZERO_COST_FALSIFICATION_REPORT.md",
      "sha256": "25db8e963fb26259c757d5c914834a46714569c2514b0c059391f3b9c3200f20"
    },
    {
      "ref": "docs/evaluations/UJ-RESPONSE-RED-001-GROK-20260819.json",
      "sha256": "67e033faa043bbab9bb135d4b98db55d8e7a2be1fbed87ae405c6e6fc841643b"
    },
    {
      "ref": "schemas/response-packet.schema.json",
      "sha256": "ee44e1b7e262bc0817e0b4f65de8830d122687618a59774fdabfddf3b7e69c0a"
    }
  ],
  "outcome": "FAIL",
  "criteria": [
    {
      "criterion_id": "AC-01",
      "result": "PASS",
      "evidence_refs": [
        "docs/evaluations/ZERO_COST_FALSIFICATION_REPORT.md",
        "https://github.com/carnascialichristian-wq/ultraJARVIS/pull/16"
      ],
      "note": "The report's 18 findings provide the requested claim, evidence, impact, severity, probability, detectability, reproducible falsification test, mitigation, owner, and STOP/GO condition."
    },
    {
      "criterion_id": "AC-02",
      "result": "PASS",
      "evidence_refs": [
        "docs/evaluations/ZERO_COST_FALSIFICATION_REPORT.md"
      ],
      "note": "The report covers paid/cloud paths, zero-card conflicts, automatic and subscription assumptions, quotas, billing, local fallback, and provider-failure behavior."
    },
    {
      "criterion_id": "AC-03",
      "result": "PASS",
      "evidence_refs": [
        "docs/evaluations/ZERO_COST_FALSIFICATION_REPORT.md"
      ],
      "note": "The report covers DepthGuard, Human Bridge, memory poisoning, Skill Forge, supply-chain exposure, and progress/ETA gaming."
    },
    {
      "criterion_id": "AC-04",
      "result": "PASS",
      "evidence_refs": [
        "docs/evaluations/ZERO_COST_FALSIFICATION_REPORT.md"
      ],
      "note": "The report compares reversible local, dry-run, mock, and hard zero-cost alternatives and stops absolute zero-cost claims where evidence is insufficient."
    },
    {
      "criterion_id": "AC-05",
      "result": "FAIL",
      "evidence_refs": [
        "docs/evaluations/UJ-RESPONSE-RED-001-GROK-20260819.json",
        "schemas/response-packet.schema.json",
        "https://github.com/carnascialichristian-wq/ultraJARVIS/commit/a71e08e97e0033a314c26cb4b05d5017bceacc84"
      ],
      "note": "The self-hash circularity was removed and the report hash is correct, but direct validation against the closed response-packet schema fails: $.verification contains the unsupported property self_hash_policy. The schema sets verification.additionalProperties=false, so this packet is not schema-valid until that property is removed or represented using an allowed field."
    }
  ],
  "findings": [
    {
      "finding_id": "F-001",
      "severity": "HIGH",
      "description": "The corrected packet still violates the closed response-packet schema because verification.self_hash_policy is an undeclared property.",
      "required_action": "Remove verification.self_hash_policy or revise the packet using only fields allowed by schemas/response-packet.schema.json. Recompute the packet bytes, rerun direct schema validation and the repository validators, then submit a new commit for re-review. Do not import the current packet."
    }
  ],
  "policy_checks": {
    "zero_cost": "PASS",
    "data_class": "PASS",
    "side_effect": "PASS",
    "secret_handling": "PASS",
    "consumer_ui_automation": "PASS"
  },
  "accepted_weight_before": 0,
  "accepted_weight_after": 0,
  "proposed_task_status": "BLOCKED",
  "next_action": "Grok must remove the unsupported verification.self_hash_policy field, recompute and validate the packet, and submit a new commit. Keep UJ-RED-001 unimported and accepted_weight at 0/13 until the next ChatGPT review passes."
}
