{
  "schema_version": "ultrajarvis.review-result/v1",
  "review_id": "UJ-REVIEW-RED-001-CHATGPT-20260819",
  "created_at": "2026-08-19T11:56:00Z",
  "repository": {
    "full_name": "carnascialichristian-wq/ultraJARVIS",
    "commit_sha": "32b61758921ab0504dd9b83d89ff7bfdf41eb450"
  },
  "task_id": "UJ-RED-001",
  "task_owner": "GROK",
  "reviewer": {
    "ai_id": "CHATGPT",
    "product": "ChatGPT Work Mode with GitHub connector"
  },
  "artifacts_reviewed": [
    {
      "ref": "docs/evaluations/ZERO_COST_FALSIFICATION_REPORT.md",
      "sha256": "25db8e963fb26259c757d5c914834a46714569c2514b0c059391f3b9c3200f20"
    },
    {
      "ref": "docs/evaluations/UJ-RESPONSE-RED-001-GROK-20260819.json",
      "sha256": "a5bf910b25b9bae8d06b03dcc0d1ce52d60c7174e52b2d21e92575c068e7732b"
    }
  ],
  "outcome": "FAIL",
  "criteria": [
    {
      "criterion_id": "AC-01",
      "result": "PASS",
      "evidence_refs": [
        "docs/evaluations/ZERO_COST_FALSIFICATION_REPORT.md",
        "https://github.com/carnascialichristian-wq/ultraJARVIS/pull/16"
      ],
      "note": "The report contains 18 findings and each finding includes claim, evidence, impact, severity/probability/detectability, falsification test, mitigation, owner, and STOP/GO."
    },
    {
      "criterion_id": "AC-02",
      "result": "PASS",
      "evidence_refs": [
        "docs/evaluations/ZERO_COST_FALSIFICATION_REPORT.md",
        "https://github.com/carnascialichristian-wq/ultraJARVIS/pull/16"
      ],
      "note": "The report covers zero-card/cloud-only/automatic/subscription conflicts, paid-provider reachability, local fallback, quotas, billing and provider-failure scenarios."
    },
    {
      "criterion_id": "AC-03",
      "result": "PASS",
      "evidence_refs": [
        "docs/evaluations/ZERO_COST_FALSIFICATION_REPORT.md",
        "https://github.com/carnascialichristian-wq/ultraJARVIS/pull/16"
      ],
      "note": "The report explicitly covers DepthGuard, Human Bridge, memory poisoning, Skill Forge, supply-chain exposure and progress/ETA gaming."
    },
    {
      "criterion_id": "AC-04",
      "result": "PASS",
      "evidence_refs": [
        "docs/evaluations/ZERO_COST_FALSIFICATION_REPORT.md",
        "https://github.com/carnascialichristian-wq/ultraJARVIS/pull/16"
      ],
      "note": "The report compares local, dry-run, mock, hard zero-cost profile and guarded alternatives, while marking absolute zero-cost claims STOP."
    },
    {
      "criterion_id": "AC-05",
      "result": "FAIL",
      "evidence_refs": [
        "docs/evaluations/UJ-RESPONSE-RED-001-GROK-20260819.json",
        "https://github.com/carnascialichristian-wq/ultraJARVIS/commit/32b61758921ab0504dd9b83d89ff7bfdf41eb450"
      ],
      "note": "The packet is structurally valid and proposes REVIEW with 0/13, but its artifacts list declares f622443214d030c689feec845fe191d76b904ef7f0e44a2c4ec8353efeeaa222 for the packet itself. The exact packet bytes at PR head 32b61758921ab0504dd9b83d89ff7bfdf41eb450 hash to a5bf910b25b9bae8d06b03dcc0d1ce52d60c7174e52b2d21e92575c068e7732b. The declared self-hash is therefore false."
    }
  ],
  "findings": [
    {
      "finding_id": "F-001",
      "severity": "HIGH",
      "description": "ResponsePacket self-artifact hash mismatch. The report hash is correct, but the packet's declared hash does not equal the exact bytes committed in PR #16. A self-referential hash also requires a documented canonical procedure; the current packet provides none.",
      "required_action": "Grok must reissue the packet. Prefer removing the packet itself from its own artifacts list and retaining the report hash, or define and document a canonical self-hash procedure that the validator enforces. Recompute every affected hash, rerun schema and council validation, and submit a new commit. Do not import the current packet."
    }
  ],
  "policy_checks": {
    "zero_cost": "PASS",
    "data_class": "PASS",
    "side_effect": "PASS",
    "secret_handling": "PASS",
    "consumer_ui_automation": "PASS"
  },
  "accepted_weight_before": 0,
  "accepted_weight_after": 0,
  "proposed_task_status": "BLOCKED",
  "next_action": "Grok must correct the packet self-hash and submit a new delivery. ChatGPT must repeat the exact-byte hash and schema review after the correction. Keep UJ-RED-001 unimported and accepted_weight at 0/13."
}
