{
  "schema_version": "ultrajarvis.review-result/v1",
  "review_id": "UJ-REVIEW-GGL-001-GROK-20260819",
  "created_at": "2026-08-19T17:30:00Z",
  "repository": {
    "full_name": "carnascialichristian-wq/ultraJARVIS",
    "commit_sha": "2d8156a9296dbc2b25a0518fbfd576cc08a8335d"
  },
  "task_id": "UJ-GGL-001",
  "task_owner": "GEMINI",
  "reviewer": {
    "ai_id": "GROK",
    "product": "SuperGrok consumer interface via human bridge + GitHub connector"
  },
  "artifacts_reviewed": [
    {
      "ref": "docs/evidence/GOOGLE_CAPABILITY_EVIDENCE_PACK.md",
      "sha256": "4fa97cf76265ec64e914ebf22d9c94a8ec431f23bb3a647d0418a0670a4767ac"
    },
    {
      "ref": "docs/program/packets/UJ-RESPONSE-GGL-001-GEMINI-001.json",
      "sha256": "7e38adb0a90e1791fccdcf410513a82880620a565fcf084021368cf87db8601c"
    }
  ],
  "outcome": "PASS_WITH_ACTIONS",
  "criteria": [
    {
      "criterion_id": "AC-01",
      "result": "PASS",
      "evidence_refs": [
        "docs/evidence/GOOGLE_CAPABILITY_EVIDENCE_PACK.md",
        "Corrected capability findings section"
      ],
      "note": "Relevant Google surfaces are classified (Gemini API, AI Studio, Vertex, ADK/A2A, Live, NotebookLM, Colab, Firebase/Firestore, Apps Script, Labs/media). Explicitly framed as evidence for routing, not required architecture. Unnecessary/unverified products kept out of ACTIVE."
    },
    {
      "criterion_id": "AC-02",
      "result": "PASS",
      "evidence_refs": [
        "docs/evidence/GOOGLE_CAPABILITY_EVIDENCE_PACK.md#Official source register",
        "docs/program/packets/UJ-RESPONSE-GGL-001-GEMINI-001.json verification.not_run"
      ],
      "note": "Material claims that are made point to official Google docs (rate limits, terms, pricing, Vertex quotas, Firebase free tier numbers, Apps Script quota table). Account-specific status is correctly marked UNKNOWN and listed under missing-evidence gates rather than asserted. Live project/billing snapshots were not taken (forbidden/not available) and are explicitly blocked."
    },
    {
      "criterion_id": "AC-03",
      "result": "PASS",
      "evidence_refs": [
        "docs/evidence/GOOGLE_CAPABILITY_EVIDENCE_PACK.md Scope and policy boundary",
        "Vertex AI BLOCKED under STRICT_ZERO_CARD"
      ],
      "note": "Strict-zero eligibility and subscription vs API separation are explicit: Vertex blocked under STRICT_ZERO_CARD; AI Studio HUMAN_BRIDGE only; free-tier Firebase numbers stated without claiming all Firebase free; no paid path activated."
    },
    {
      "criterion_id": "AC-04",
      "result": "PASS",
      "evidence_refs": [
        "docs/evidence/GOOGLE_CAPABILITY_EVIDENCE_PACK.md Corrected capability findings"
      ],
      "note": "ACTIVE is not overused. PREVIEW/UNKNOWN/HUMAN_BRIDGE/BLOCKED are visibly separated for Live, Labs/media, NotebookLM, Colab, Firebase, Apps Script, Vertex. Product names alone are not treated as proof of rollout or rights."
    },
    {
      "criterion_id": "AC-05",
      "result": "PASS",
      "evidence_refs": [
        "docs/program/packets/UJ-RESPONSE-GGL-001-GEMINI-001.json",
        "schemas/response-packet.schema.json"
      ],
      "note": "ResponsePacket is separate from UJ-CAP-001, schema required fields present, status=REVIEW, proposed_accepted_weight=0, artifacts list only the external evidence pack with matching SHA-256 (no circular self-hash). source_commit_sha is a real 40-hex commit (3611b1b…) that is fetchable; see finding F-001 for card-repin note."
    }
  ],
  "findings": [
    {
      "finding_id": "F-001",
      "severity": "LOW",
      "description": "Packet source_commit_sha is 3611b1b400cf57b5021bab228a3de9470d6eca5c (fetchable). The live delegation card on main was later repinned to 25b1b7d53ff5bc4b05348453ebb704aba3a88630. Google evidence is primarily external-docs-based, so analysis content remains usable, but future packets should prefer the current card read_ref.",
      "required_action": "Importer/review notes: accept this delivery against 3611b1b for content; optional follow-up resend may update source_commit_sha to current card read_ref without changing findings."
    },
    {
      "finding_id": "F-002",
      "severity": "MEDIUM",
      "description": "Live account/project/billing/quota snapshot, Italy/EEA terms check, exact NotebookLM privacy citation, Firebase Spark-only project evidence, and Apps Script side-effect approvals remain open. Gemini correctly listed these as blockers rather than inventing certainty.",
      "required_action": "Do not unlock UJ-INF-001 / UJ-ADK-001 / UJ-KNW-001 / UJ-MED-001 / UJ-MEM-001 on this packet alone. Require human-bridge live checks before ACTIVE routing of those surfaces."
    },
    {
      "finding_id": "F-003",
      "severity": "INFO",
      "description": "Evidence pack is concise (~109 lines) and deliberately conservative. Quarantine of prior unsupported claims is present on the branch. Policy attestation (no paid API, no billing, no consumer UI automation, no secrets) is credible given static-only delivery.",
      "required_action": "None for acceptance of REVIEW status; keep accepted_weight at 0 until program importer processes this ReviewResult."
    }
  ],
  "policy_checks": {
    "zero_cost": "PASS",
    "data_class": "PASS",
    "side_effect": "PASS",
    "secret_handling": "PASS",
    "consumer_ui_automation": "PASS"
  },
  "accepted_weight_before": 0,
  "accepted_weight_after": 0,
  "proposed_task_status": "REVIEW",
  "next_action": "CHATGPT/importer may record this independent Grok ReviewResult. Keep UJ-GGL-001 at REVIEW with accepted_weight 0/13. Do not mark DONE. Do not unlock downstream Google-dependent tasks until live-evidence gates (F-002) are closed by a separate approved card. Optionally note F-001 source_commit_sha vs current card read_ref."
}
